{
  "audience_id": "synthetic-audience-v1",
  "label": "Synthetic audience contract fixture",
  "filters": {
    "plan": ["basic", "max"]
  },
  "factor_summary": [
    {
      "key": "plan",
      "label": "Core SaaS plan tier",
      "source": "synthetic_fixture"
    },
    {
      "key": "usage_band",
      "label": "Jobs created 28-day band",
      "source": "synthetic_fixture"
    }
  ],
  "org_uuid_evidence": [
    {
      "org_uuid": "11111111-1111-4111-8111-111111111111",
      "org_id": "synthetic-org-1",
      "matched_factors": {
        "plan": "basic",
        "usage_band": "low"
      },
      "evidence_source": "synthetic_fixture",
      "observed_at": "2026-08-06T00:00:00Z"
    },
    {
      "org_uuid": "22222222-2222-4222-8222-222222222222",
      "org_id": "synthetic-org-2",
      "matched_factors": {
        "plan": "max",
        "usage_band": "high"
      },
      "evidence_source": "synthetic_fixture",
      "observed_at": "2026-08-06T00:00:00Z"
    }
  ],
  "extract_manifest": {
    "source_kind": "synthetic_fixture",
    "source_table": "none",
    "row_count": 2,
    "universe_row_count": 2,
    "query_hash": "synthetic-not-a-production-query",
    "observed_at": "2026-08-06T00:00:00Z",
    "notes": "No customer identifiers or production-derived values. Shape-only fixture."
  }
}
